Created Date,Record Number,Record Type,Status,Address,Property/Project Name,Description,Expiration Date,Column 1,Column 2,Latitude,Longitude,Processed_Category
09/16/2025,004925-25PA,Building & Land Use Pre-Application,In Process,2601    50TH  AVE  SW  SEATTLE,2601 Boundary Line Adjustment,"Currently developing a Detached Accessory Dwelling Unit (DADU) in the backyard, consisting of two units that will be combined and classified as a single-family residence. The existing single-family residence (SFR) on the property will be converted into a DADU.I am requesting approval to apply for a boundary line adjustment between the three units.",,,,47.58108365,-122.39555017464048,DADU
09/16/2025,004949-25PA,Building & Land Use Pre-Application,Completed,13510    25th  AVE  NE,New DADU,replacing permit 6879613-CN  garage with a new 2 story DADU,,,,47.72690660000001,-122.30119261154195,DADU
09/16/2025,004929-25PA,Building & Land Use Pre-Application,Completed,1028   NE  100TH  ST   SEATTLE,Justin DADU,Complete and final for 6932474-CN,,,,47.7014765,-122.31621874999999,DADU
09/15/2025,004914-25PA,Building & Land Use Pre-Application,Completed,11223    DAYTON  AVE  N  SEATTLE,11223 Dayton - 4 Unit Lot Sub,"4 Unit, Unit Lot Subdivision of 4 Detached Residential Buildings, which are being permitted under 7093597-CN.",,,,47.71127645,-122.35313867206443,Unit Lot Subdivision (ULS)
09/15/2025,004897-25PA,Building & Land Use Pre-Application,Completed,720    33RD  AVE  S  SEATTLE,2519,"Demo existing SFR.  Construct 4 New Units on corner lot.  Curb cut each street, need DM and CN record numbers.",,,,47.60856785,-122.29015740068999,Multiplex/Cluster
09/15/2025,004915-25PA,Building & Land Use Pre-Application,Completed,1212   E  SHELBY  ST   SEATTLE,C+C Residence,Demolish existing 712 sq. ft. single story floating home and existing 1282.5 sq. ft. log float. Construct new 1684 sq. ft. two story floating home on new 1282.5 sq. ft. log float.,,,,47.64709045,-122.31530155113239,Multiplex/Cluster
09/15/2025,004904-25PA,Building & Land Use Pre-Application,Completed,807   NE  80TH  ST   SEATTLE,Kyrylo Sokolov. DADU,"Construction of a 3-story 2B/2B 1,000 sq ft DADU on the south portion of the property",,,,47.686565200000004,-122.31983922471743,DADU
09/15/2025,004905-25PA,Building & Land Use Pre-Application,Completed,111   N  ARGYLE  PL   SEATTLE,,Construct new SFR. Existing SFR to remain. Future Unit Lot Subdivision,,,,47.668942349999995,-122.35642872843601,Unit Lot Subdivision (ULS)
09/15/2025,004901-25PA,Building & Land Use Pre-Application,Completed,9052    EVANSTON  AVE  N  SEATTLE,,Build (2) new Single-Family Residences. Existing SFR to remain.,,,,47.6958561,-122.35092376123507,Multiplex/Cluster
09/15/2025,004907-25PA,Building & Land Use Pre-Application,Completed,1917    3RD  AVE  W  SEATTLE,,"DEMOLISH EXISTING BUILDING,CONSTRUCT A NEW SFR WITH PARKING PER PLAN.",,,,47.6118736,-122.3403394,Single Family Residence
09/15/2025,004910-25PA,Building & Land Use Pre-Application,Additional Info Requested,9340    55TH  AVE  S  SEATTLE,Bing Mayton,"Remove Rear (illegally built add-on), part of building, which is falling down.Wall up exposed rear wall of house. Clean up demo debris.",,,,47.51779165,-122.26368008584888,Single Family Residence
09/15/2025,004898-25PA,Building & Land Use Pre-Application,Completed,3528   NE  125TH  ST   SEATTLE,,Add (2) new DADUs behind existing house.,,,,47.7194044,-122.28951049615284,DADU
09/15/2025,004917-25PA,Building & Land Use Pre-Application,Completed,9454    24TH  AVE  SW  SEATTLE,Nicholas Reilly - 25-0257 - (2 DADUs),NEW DESCRIPTION:  CONSTRUCTING 3 NEW TOWNHOUSE UNITS ON LOT WITH EXISTING SFROLD DESCRIPTION:  Constructing 2 new detached ADUs that are attached to one another,,,,47.5175683,-122.3630136,Townhouse
09/14/2025,004894-25PA,Building & Land Use Pre-Application,Completed,5640    23RD  AVE  SW  SEATTLE,,ADU-I would you enclose my existing carport and attach to the house,,,,47.550604500000006,-122.36152863695179,ADU
09/13/2025,004888-25PA,Building & Land Use Pre-Application,Completed,1405   NW  100TH  ST,UNIT LOT SUBDIVISION,"CREATE 3 UNIT LOTS TO SERVE EXISTING SFD, RECENTLY PERMITTED DADU, AND ONE FUTURE SFD",,,,47.63029565,-122.31413540328062,Unit Lot Subdivision (ULS)
09/13/2025,004885-25PA,Building & Land Use Pre-Application,Completed,3543   S  BENNETT  ST   SEATTLE,Bennett Duplex,New Duplex behind existing home,,,,47.554070100000004,-122.28749738721962,Multiplex/Multifamily
09/12/2025,004879-25PA,Building & Land Use Pre-Application,Completed,3907   S  ANGEL  PL   SEATTLE,,To construct two DADUs in an existing single family lot.,,,,47.5444259,-122.28293019318764,DADU
09/12/2025,004875-25PA,Building & Land Use Pre-Application,Completed,836   NE  102ND  ST   SEATTLE,Maple Leaf Unit 2,Construct 1 family dwelling per unit plans. Review and processing for 2 new structures under 7039274-CN & 7059587-CN,,,,47.70237065,-122.31880104999999,Multiplex/Cluster
09/12/2025,004871-25PA,Building & Land Use Pre-Application,Completed,11531    7TH  AVE  NE  SEATTLE,,2-lot LBA,,,,47.71317285,-122.32234206548677,Unit Lot Subdivision (ULS)
09/12/2025,004865-25PA,Building & Land Use Pre-Application,Withdrawn,11409    34TH  AVE  SW  SEATTLE,Shed,This Permit application is in response to NOV Case No 1061641-VI. We replaced an existing garden shed that was rotted out with a new pre-fab style shed on the southwest side of the home. The dimensions of this shed are 14â€ x 8â€ (112 sq. Ft.) which we understand is under the 120 sq. Ft. Threshold to require a permit.,,,,47.5009791,-122.37580316646822,Multiplex/Cluster
09/12/2025,004872-25PA,Building & Land Use Pre-Application,Completed,421   SW  THISTLE  ST,,LBA,,,,47.528072550000005,-122.34113415964418,Unit Lot Subdivision (ULS)
09/12/2025,004863-25PA,Building & Land Use Pre-Application,Completed,807    29TH  AVE  E  SEATTLE,807 29th Ave E - PASV,CONSTRUCT 4 DWELLING UNITS. PARKING PER PLAN. FUTURE ULS.,,,,47.6261767,-122.29536599998204,Unit Lot Subdivision (ULS)
09/11/2025,004845-25PA,Building & Land Use Pre-Application,Completed,6849    26TH  AVE  NE  SEATTLE,,4-UNIT ULS,,,,47.67899175,-122.29987601630013,Unit Lot Subdivision (ULS)
09/11/2025,004850-25PA,Building & Land Use Pre-Application,Completed,1500    BROADMOOR  DR  E  SEATTLE,Blakeslee Residence,New Single-Family Residence,,,,47.63302675,-122.28803276928407,Single Family Residence
09/11/2025,004846-25PA,Building & Land Use Pre-Application,Completed,2301   NE  125TH  ST   SEATTLE,New SFR/ADU 24-0302,New SFR and ADU on East portion of lot.,,,,47.7191633,-122.30425439999999,ADU
09/11/2025,004849-25PA,Building & Land Use Pre-Application,Completed,6519   NE  61ST  ST,Duryee Residence & ADU,Construct 3-story residence with 2nd-story ADU within similar footprint as previous 1-story residence on site (to be demolished under separate permit).,,,,47.672770299999996,-122.25725251191389,ADU
09/10/2025,004836-25PA,Building & Land Use Pre-Application,Completed,3000   S  GRAHAM  ST   SEATTLE,jwa754,EXISTING SFR TO REMAIN AND CONSTRUCT 3 UNITS WITH (3) ATTACHED GARAGES,,,,47.5471511,-122.3710357,Multiplex/Cluster
09/10/2025,004825-25PA,Building & Land Use Pre-Application,Completed,5122   S  BRIGHTON  ST   SEATTLE,Brighton Street Development,"Construct a duplex consisting of two stacked flats and three one-car garages, per plans. Flats to be located above garages. Establish use and occupy, per plans.",,,,47.54180635,-122.26887949839885,Multiplex/Multifamily
09/10/2025,004832-25PA,Building & Land Use Pre-Application,Completed,3947   S  MORGAN  ST   SEATTLE,,4 lot uls,,,,47.54371795,-122.28125848333775,Unit Lot Subdivision (ULS)
09/10/2025,004831-25PA,Building & Land Use Pre-Application,Completed,435    LAKE WASHINGTON  BLVD   SEATTLE,435 Lake Washington,Removal of an existing single family home and replacement with a new construction single family home.,,,,47.60579295,-122.28388739324495,Single Family Residence
09/10/2025,004827-25PA,Building & Land Use Pre-Application,Completed,12529    14TH  AVE  NE  SEATTLE,Two new DADUs 25-0208,Two new standard plan detached accessory dwelling units on West Portion of lot per 6880595-SP,,,,47.7203347,-122.31435046688122,DADU
09/10/2025,004834-25PA,Building & Land Use Pre-Application,Completed,4118    EVANSTON  AVE  N  SEATTLE,Nicholas Reilly - 24-0314 - SFR,New SFR on lot,,,,47.65724105,-122.35085545000001,Multiplex/Cluster
09/10/2025,004823-25PA,Building & Land Use Pre-Application,Completed,128   NW  49TH  ST   SEATTLE,Nelis Project,"**SCHEDULE PASV**Construct denuding and replanting of yard of a single-family residence, per plans",,,,47.664524549999996,-122.35580074943846,Single Family Residence
09/09/2025,004808-25PA,Building & Land Use Pre-Application,Completed,9119    7TH  AVE  S  SEATTLE,Mike Ennen,New construction of 6 (3 story) structures on three lots. 4 Structures - SBC Triplex's & 2 Structures - SRC Duplex with an AADU.,,,,47.521706449999996,-122.32339799898435,AADU
09/09/2025,004814-25PA,Building & Land Use Pre-Application,Completed,11279    59th  AVE  S,PnB 59th Ave. S. Townhomes,Add three new town houses alongside existing single family house,,,,47.4978559,-122.2598984,Townhouse
09/07/2025,004772-25PA,Building & Land Use Pre-Application,Completed,7728    MERIDIAN  AVE  N  SEATTLE,Meridian Ave Homes,"DEMOLISH EXISTING STRUCTURES AND CONSTRUCT ONE (1)DETACHED PRIMARY RESIDENTIAL HOME, ONE (1) ATTACHED PRIMARY RESIDENTIAL HOME & 2ATTACHED ACCESSORY DWELLINGUNITS (AADU'S).",,,,47.6859409,-122.33272817518073,AADU
09/07/2025,004771-25PA,Building & Land Use Pre-Application,Completed,12046    6TH  AVE  NW  SEATTLE,,DEMOLITION OF EXISTING DWELLING AND CONSTRUCTION OF FOUR NEW DWELLING UNITS WITH FUTURE UNIT LOT SUBDIVISION,,,,47.7176745,-122.36325375239522,Unit Lot Subdivision (ULS)
09/05/2025,004763-25PA,Building & Land Use Pre-Application,Completed,521    STADIUM  PL  S  SEATTLE,MultiFamily Renovation,Interior TI: adding a secondary stair to an existing mezzanine per plan,,,,47.5979613,-122.33244084787844,Multiplex/Multifamily
09/05/2025,004770-25PA,Building & Land Use Pre-Application,Completed,4411    DAYTON  AVE  N  SEATTLE,Dayton Ave Residence,"remove existing single family residence (two stories + basement) and replace with new approx. 5,000sf (+/-) single family residence and small 200sf (+/-) accessory structure at rear of lot. remove small trees as allowed.",,,,47.6605756,-122.35232434366196,Multiplex/Cluster
09/05/2025,004748-25PA,Building & Land Use Pre-Application,Completed,1808    M L KING JR  WAY   SEATTLE,,Existing DADU to remain (1806 MLK Way)Demo existing SFRConstruct new 3-story SFR with garage and new 3-story ADU without parking. Surface stall to remain for existing DADU. Existing curb cut to remain.,,,,38.886100049999996,-77.04434084918319,DADU
09/05/2025,004747-25PA,Building & Land Use Pre-Application,Reviews Completed,328   NE  125TH  ST   SEATTLE,jwa791,construct (4) SFRs with (2) attached garages and (3) open parking. Existing SFR & DADU to remain,,,,47.7194025,-122.3022689,DADU
09/05/2025,004767-25PA,Building & Land Use Pre-Application,Completed,5955    23RD  AVE  S  SEATTLE,Pre-Application,"Project is located in Seattle with the address 5955 23rd Ave S, Seattle. We are proposing 3 middle housing units -  town house attached on the lot behind the existing house.",,,,47.548214,-122.30466305,Middle Housing
09/05/2025,004769-25PA,Building & Land Use Pre-Application,Completed,8620    RENTON  AVE  S  SEATTLE,MEKETE AADU,permit and inspect existing AADU,,,,47.52543455,-122.27644889226933,AADU
09/05/2025,004759-25PA,Building & Land Use Pre-Application,Completed,8320    30TH  AVE  NW  SEATTLE,,Demolish existing SFR.  Construct new SFR with detached garage and DADU,,,,47.6893322,-122.39545880810219,DADU
09/04/2025,004732-25PA,Building & Land Use Pre-Application,Reviews Completed,610   N  143RD  ST   SEATTLE,Modern 610 N 143rd,CONSTRUCT (1) SINGLE FAMILY RESIDENCE AND (2) DETACHED ACCESSORY DWELLING UNITS,,,,47.732297605368394,-122.34958909400414,ADU
09/04/2025,004727-25PA,Building & Land Use Pre-Application,Completed,6804    47TH  AVE  NE  SEATTLE,MACFARLANE HOMES 6804 47TH AVE NE,"DEMOLISH EXISTING HOUSE AND GARAGE.  CONSTRUCT TWO NEW DWELLINGS, ABOUT 2,700 SF EACH, WITH 2-CAR GARAGES.",,,,47.677776050000006,-122.27766006881023,Multiplex/Cluster
09/04/2025,004735-25PA,Building & Land Use Pre-Application,Completed,13757    39TH  AVE  NE  SEATTLE,,"CONSTRUCTION (4) NEW MIDDLE HOUSING UNIT PER PLAN, W/ ATTACHED GARAGE PARKING PROVIDED, EXISTING SFR TO BE DEMOLISHED.",,,,47.72994605,-122.28730295330499,Middle Housing
09/04/2025,004739-25PA,Building & Land Use Pre-Application,Completed,13759    2ND  AVE  NW  SEATTLE,2nd Ave SFR,Demolish existing attached garage and construct (1) new SFR behind existing house,,,,47.7303706,-122.35998158573528,Single Family Residence
09/04/2025,004731-25PA,Building & Land Use Pre-Application,Completed,136   N  77th  ST,,"DEMOLISH EXISTING HOUSE AND CONSTRUCT:Â·	FOUR (4) THREE-STORY SINGLE-FAMILY HOMESÂ·	TWO (2) GARAGES AND FOUR (4) SURFACE PARKING SPACESÂ·	HARD SURFACE AREA: LESS THAN 5,000 SF",,,,47.6849388,-122.35963759999645,Multiplex/Cluster
09/04/2025,004733-25PA,Building & Land Use Pre-Application,Completed,6508    50TH  AVE  NE  SEATTLE,Hassan ADU Seattle,Conversion of existing finished basement to ADU (869 sf),,,,47.676050450000005,-122.2738322930073,ADU
09/04/2025,004726-25PA,Building & Land Use Pre-Application,Completed,1445   S  HENDERSON  ST   SEATTLE,Boeing 15-008 Install Additional Plotter Table,"Project consists of architectural, structural, mechanical and electrical modifications to the 15-008 building to install a new Kongsberg C68 plotter table, which will include new utility connections and structural pedestal supports. Also, includes the construction of a 98 SF exterior shelter on the north side of the building which will house new vacuum pumps to support the new plotter table.",,,,47.5227992,-122.3130626,Multiplex/Cluster
09/04/2025,004724-25PA,Building & Land Use Pre-Application,Completed,8124    18TH  AVE  SW  SEATTLE,8124 18th Ave SW,Establish basement in existing SFR as an AADU. 1st Floor in SFR to remain unaltered.,,,,47.52931485,-122.35745367317597,AADU
09/04/2025,004738-25PA,Building & Land Use Pre-Application,In Process,9325    7TH  AVE  S  SEATTLE,,2 lot short subdivision,,,,47.519881600000005,-122.32527478007063,Unit Lot Subdivision (ULS)
09/04/2025,004737-25PA,Building & Land Use Pre-Application,Completed,13337    30TH  AVE  NE  SEATTLE,Two new SFRs,"Two new single family residences on rear of lot, behind existing SFR.",,,,47.725862449999994,-122.29671438395857,Multiplex/Cluster
09/03/2025,004705-25PA,Building & Land Use Pre-Application,Completed,4563    34TH  AVE  W  SEATTLE,,"DEMOLISH EXISTING BUILDING,CONSTRUCT SFR, AND ADU, WITH PARKING PER PLAN",,,,47.66289475,-122.40187019654701,ADU
09/03/2025,004709-25PA,Building & Land Use Pre-Application,Completed,6527    32ND  AVE  NW  SEATTLE,,Demo of existing Single Family. New construction of (1) single family (1) AADU & (1) DADU.,,,,47.5441417,-122.3740204,DADU
09/03/2025,004703-25PA,Building & Land Use Pre-Application,Completed,5720   S  MORGAN  PL   SEATTLE,Lot Line Adjustment,"I'm changing a lot boundary, and that's all.",,,,47.54379765,-122.2608543134907,Unit Lot Subdivision (ULS)
09/03/2025,004714-25PA,Building & Land Use Pre-Application,Completed,3056    48TH  AVE  SW  SEATTLE,,"DEMOLISH EXISTING BUILDING, CONSTRUCT TWO NEW SFR'S, AND ONE NEW DUPLEX, WITH PARKING PER PLAN.",,,,47.5758286,-122.39296644542485,Duplex + SFR
09/03/2025,004712-25PA,Building & Land Use Pre-Application,Completed,10461    62ND  AVE  S  SEATTLE,10461 62nd Ave S,Build four new single family dwellings. Existing SFR to remain unaltered.,,,,47.5064935,-122.2561871,Multiplex/Cluster
09/03/2025,004706-25PA,Building & Land Use Pre-Application,Completed,4147    44TH  AVE  SW  SEATTLE,,"DEMOLISH EXISTING BUILDING,CONSTRUCT TWO NEW DUPLEX'S, WITH PARKING PER PLAN.",,,,47.56520855,-122.38846172535503,Multiplex/Multifamily
09/03/2025,004719-25PA,Building & Land Use Pre-Application,Reviews Completed,4712   NE  100TH  ST   SEATTLE,4712-REAR YARD,RETAIN EXISTING SFR AND CONSTRUCT NEW SFR IN REAR YARD AND REBUILD EXISTING GARAGE AND ESTABLISH DADU IN ITS PLACE.,,,,47.70134535,-122.27696615090574,DADU
09/03/2025,004722-25PA,Building & Land Use Pre-Application,Completed,4057    49TH  AVE  SW  SEATTLE,Jed Brongil and Annie Olson,"add a second and third story to an existing single story, single family home",,,,47.566849250000004,-122.39514070039158,ADU/Duplex
09/03/2025,004702-25PA,Building & Land Use Pre-Application,Completed,5569    23RD  AVE  S  SEATTLE,5569 new DADU,New standard plan DADU to be constructed on the west portion of lot facing alley per 6880596-SP.,,,,47.551305400000004,-122.30431440291478,DADU
09/02/2025,004688-25PA,Building & Land Use Pre-Application,Additional Info Requested,14319    20th  AVE  NE,Senidun Abebe,add two bedrooms and 2 bath on the existing structured used as an adult Family home,,,,47.7327078,-122.30779070599294,Single Family Residence
09/02/2025,004692-25PA,Building & Land Use Pre-Application,Completed,,,"CONSTRUCT (1) NEW MIDDLE HOUSING UNIT PER PLAN, W/ (1)ATTACHED GARAGE PARKING PROVIDED, EXISTING SFR TO REMAIN",,,,,,Middle Housing
09/02/2025,004680-25PA,Building & Land Use Pre-Application,Completed,1611    8TH  AVE  N  SEATTLE,1611 Unit Conversion,COMBINE TWO EXISTING APARTMENT UNITS INTO ONE UNIT. NO GROUND DISTURBANCE.,,,,47.63334625,-122.34142904769445,Multiplex/Multifamily
09/02/2025,004681-25PA,Building & Land Use Pre-Application,Completed,7714    M L KING JR  WAY  S  SEATTLE,,DEMOLITION OF EXISTING STRUCTURE IN PREPARATION OF BEGINNING CONSTRUCTION ON PERMITTED TOWNHOUSE PROJECTS,,,,38.886100049999996,-77.04434084918319,Townhouse
09/02/2025,004675-25PA,Building & Land Use Pre-Application,Completed,200    SUE BIRD  CT  N  SEATTLE,PacSci Building 2 Exhibit Circulation Enhancement Doors,Add a new pair of pass-through doors and associated drywall construction between Building 2 and Building 1A to facilitate exhibit circulation. The project includes cutting a new opening through existing load-bearing concrete pre-cast wall panels with structural steel channel frame added to maintain structural integrity of the existing wall.,,,,47.61934015,-122.35077847477159,Multiplex/Cluster
09/01/2025,004664-25PA,Building & Land Use Pre-Application,Completed,11106    LUTHER  AVE  S  SEATTLE,Construct 4 New Dwelling Units,Construct 4 new dwelling units within 2 separate structures.,,,,47.5012596,-122.26679500578484,Multiplex/Cluster
09/01/2025,004666-25PA,Building & Land Use Pre-Application,Completed,3100   SW  ADMIRAL  WAY   SEATTLE,3100 SW Admiral Way,New development for 3-4 neighborhood residential structures in a vacant property. We need a pre-site inspection and preliminary assessment report. We would like to apply for a steep slope relief,,,,47.5814821,-122.38643,Multiplex/Cluster
08/31/2025,004657-25PA,Building & Land Use Pre-Application,Completed,4928    43RD  AVE  S  SEATTLE,,ADDING 2 NEW RESIDENTIAL UNITS,,,,47.55732,-122.2791655,Multiplex/Cluster
08/31/2025,004656-25PA,Building & Land Use Pre-Application,Completed,4015    43rd  AVE  S,NEW SFD,NEW SFD TO REPLACE SFD DESTROYED BY ARSON IN AUGUST 2024.  PROPOSAL INCLUDES REQUEST FOR RELIEF FROM STEEP SLOPE DEVELOPMENT PURSUANT TO SMC 25.09.180.B.2.b.,,,,47.567152050000004,-122.27988884837305,Multiplex/Cluster
08/29/2025,004654-25PA,Building & Land Use Pre-Application,Completed,722    24TH  AVE  S  SEATTLE,Cedrus Cooperative,"Ten-unit stacked flats residential development using Section 23.44.170 Alternative standards for development of low-income housing of the draft One Seattle Plan. The development will have four buildings. Building A and D will have three ~500sqft one-bedroom flats each. Building B and C will have two ~400sqft one-bedroom flats each and ~600sqft of shared communal space.  The development will be 6,850sqft with a 1.4 FAR. There is no planned parking on site.",,,,47.596077550000004,-122.3008924653235,Multiplex/Cluster
08/29/2025,004633-25PA,Building & Land Use Pre-Application,Completed,4115   SW  ELMGROVE  ST   SEATTLE,,"DEMOLISH EXISTING BUILDING,CONSTRUCT FOUR NEW SFR'S, WITH PARKING PER PLAN.",,,,47.53056355,-122.3854500743238,Multiplex/Cluster
08/29/2025,004638-25PA,Building & Land Use Pre-Application,Completed,8601    FREMONT  AVE  N  SEATTLE,Greenwood,Our PAR has expired. 3-story apartment building (53 units total). Parking for 11 vehicles proposed.,,,,47.6510483,-122.347234,Multiplex/Multifamily
08/29/2025,004645-25PA,Building & Land Use Pre-Application,Completed,7420    LATONA  AVE  NE  SEATTLE,,4 lot ULS,,,,47.682581299999995,-122.32584365118271,Unit Lot Subdivision (ULS)
08/29/2025,004641-25PA,Building & Land Use Pre-Application,Completed,3624    DENSMORE  AVE  N  SEATTLE,3624 Densmore Ave N - PAR,"Demo existing structure, construct 4 new SFRs",,,,47.6513195,-122.3371415,Multiplex/Cluster
08/29/2025,004648-25PA,Building & Land Use Pre-Application,Completed,306   NW  45TH  ST   SEATTLE,DADU 306 NW 45th,25-0245 - Erez DADUNew DADU per Standard plan 6880596-SP facing alley to the north of the lot.,,,,47.6616281,-122.3611613067221,DADU
08/29/2025,004635-25PA,Building & Land Use Pre-Application,Completed,3522    ASHWORTH  AVE  N  SEATTLE,,"DEMOLISH EXISTING BUILDING,CONSTRUCT TWO NEW SFR'S, WITH PARKING PER PLAN.WITH FUTURE ULS",,,,47.6499393,-122.3399002,Unit Lot Subdivision (ULS)
08/29/2025,004631-25PA,Building & Land Use Pre-Application,Completed,2336   N  55TH  ST   SEATTLE,,REMOVE EXISTING SINGLE-FAMILY RESIDENCE. BUILD 2 NEW SINGLE-FAMILY RESIDENCES. EXISTING CARPORT STRUCTURE AND PARKING TO REMAIN.,,,,47.6688719,-122.32848419921646,Multiplex/Cluster
08/29/2025,004630-25PA,Building & Land Use Pre-Application,Completed,4136    44TH  AVE  SW  SEATTLE,,"DEMOLISH EXISTING BUILDING,CONSTRUCT TWO NEW DUPLEX'S, WITH PARKING PER PLAN WITH FUTURE ULS",,,,47.5654817,-122.38780440609585,Unit Lot Subdivision (ULS)
08/29/2025,004647-25PA,Building & Land Use Pre-Application,Completed,2213   NW  62ND  ST   SEATTLE,,6 lot unit lot subdivision,,,,47.673667949999995,-122.38540974096315,Unit Lot Subdivision (ULS)
08/28/2025,004614-25PA,Building & Land Use Pre-Application,Completed,11515    34TH  AVE  NE  SEATTLE,,Construct two new single family residences. Existing SFR to remain.Future Unit Lot Subdivision,,,,47.7124735,-122.29229290054194,Unit Lot Subdivision (ULS)
08/28/2025,004617-25PA,Building & Land Use Pre-Application,Completed,603    3rd  AVE  W,Regan Lee Annex,"Construct a 6 story, single stair apartment building with 20 units and 7 parking stalls.",,,,47.6028627,-122.3317889,Multiplex/Multifamily
08/28/2025,004622-25PA,Building & Land Use Pre-Application,Completed,6617    WOODLAWN  AVE  N  SEATTLE,,"CONSTRUCT ONE SFR AND ONE DADU, PARKING PER PLAN.ASSOCIATE PAR NUMBER 001272-25PA",,,,47.6777425,-122.33076176573171,DADU
08/28/2025,004612-25PA,Building & Land Use Pre-Application,Completed,6601   NE  WINDERMERE  RD   SEATTLE,Custom Homes SP,Subdivide and existing NR1 zoned property into 3 lots. Existing structure to remain.,,,,47.6702614,-122.270464,Unit Lot Subdivision (ULS)
08/27/2025,004593-25PA,Building & Land Use Pre-Application,In Process,1408   N  137TH  ST   SEATTLE,Bitter Lake Middle Housing,A new construction residential fourplex in the Bitter Lake neighborhood,,,,47.72887115,-122.3404905414092,Middle Housing
08/27/2025,004609-25PA,Building & Land Use Pre-Application,Completed,5806    56TH  AVE  NE  SEATTLE,,Construct a SFR and ADU with detached garage. Demo existing SFR.,,,,47.670582,-122.26781415347588,ADU
08/27/2025,004606-25PA,Building & Land Use Pre-Application,Completed,4213    42ND  AVE  S  SEATTLE,,"Establish use as single-family residence and townhouse per land use code.Construct duple ad SFR with 3 surface parking on each lot for a total of 6 units and 6 surface parking combined. Lots share driveway, walkways, and turnaround. Demo SFR on south lot. North lot vacant.",,,,47.56487225,-122.28102038991364,Townhouse
08/26/2025,004585-25PA,Building & Land Use Pre-Application,Completed,8211    DENSMORE  AVE  N  SEATTLE,820x Densmore Ave N,Construct 4 dwelling units in 2 duplexes with 2-4 surface parking stalls adjacent to alley. Parcel number for proposed project is 1993200085 (directly south of 8211 Densmore Ave N),,,,47.6891324,-122.33808445513827,Multiplex/Cluster
08/26/2025,004590-25PA,Building & Land Use Pre-Application,Completed,3819    33RD  AVE  W  SEATTLE,,Remove existing structures.Construct four (4) townhomes with parking via new curb cut.,,,,47.654719650000004,-122.39980528551814,Townhouse
08/26/2025,004580-25PA,Building & Land Use Pre-Application,Completed,3056    48TH  AVE  SW  SEATTLE,,"DEMOLISH EXISTING BUILDING, CONSTRUCT TWO NEW SFR'S, AND ONE NEW DUPLEX, WITH PARKING PER PLAN.FUTURE ULS OF ALL UNITS.",,,,47.5758286,-122.39296644542485,Duplex + SFR
08/26/2025,004570-25PA,Building & Land Use Pre-Application,Completed,9559    COLLEGE  WAY  N  SEATTLE,,Remove existing structures. Construct 4 new Dwelling Units. Future Unit Lot Subdivision.,,,,47.69945315,-122.33545985862588,Unit Lot Subdivision (ULS)
08/26/2025,004574-25PA,Building & Land Use Pre-Application,Completed,2443    5TH  AVE  W  SEATTLE,,"DEMOLISH EXISTING BUILDING, CONSTRUCT TWO NEW DUPLEXES, WITH PARKING PER PLAN.FUTURE ULS OF ALL UNITS.",,,,47.6408436,-122.36388132495108,Unit Lot Subdivision (ULS)
08/26/2025,004591-25PA,Building & Land Use Pre-Application,Completed,7502    14TH  AVE  SW  SEATTLE,,Construct 2 SFR with attached garages. Existing SFR to remain.,,,,47.5353032,-122.35235134484576,Multiplex/Cluster
