Created Date,Record Number,Record Type,Status,Address,Property/Project Name,Description,Expiration Date,Column 1,Column 2,Latitude,Longitude,Processed_Category
07/18/2025,003854-25PA,Building & Land Use Pre-Application,Withdrawn,6110    DAYTON  AVE  N  SEATTLE,Level 2 EV Charger,We would like to add a level 2 electric vehicle charger to the exterior of our DADU.,,,,47.70473153526294,-122.35277335070549,DADU
07/18/2025,003858-25PA,Building & Land Use Pre-Application,Completed,3407    BEACON  AVE  S  SEATTLE,Situ Apartments,Construct new 6 unit apartment and reconfigure existing residence.,,,,47.5727738,-122.3090026896792,Multiplex/Multifamily
07/18/2025,003868-25PA,Building & Land Use Pre-Application,Withdrawn,10217    42nd  AVE  SW,Installing EV Charging Station,We would like to install an EV charging station. It would be hardwired to our panel. The station will be on the edge of our property accessible via the parking strip in front of our house.,,,,47.51153205,-122.38612824227813,Single Family Residence
07/18/2025,003861-25PA,Building & Land Use Pre-Application,Completed,3944   S  ANGELINE  ST   SEATTLE,2 NEW UNITS,CONSTRUCT (2) NEW DETACHED DWELLING UNITS.DEMO EXISTING DETACHED GARAGE. NO CHANGE TO EXISTING SFR.,,,,47.559639250000004,-122.28148419261541,Multiplex/Cluster
07/17/2025,003812-25PA,Building & Land Use Pre-Application,Completed,3623   SW  OTHELLO  ST   SEATTLE,,"DEMOLISH EXISTING BUILDING,CONSTRUCT FOUR NEW SFR'S, WITH PARKING PER PLAN.",,,,47.536634649999996,-122.37945299486549,Multiplex/Cluster
07/17/2025,003831-25PA,Building & Land Use Pre-Application,Additional Info Requested,9412    15TH  AVE  NE  SEATTLE,,"REMOVE EXISTING STRUCTURES. BUILD 4 NEW SINGLE FAMILY RESIDENCES, PER PLAN. PARCEL ""E"" OF LBA PRE-APP 003795-25PA. FUTURE ULS.",,,,47.6970711,-122.3114692,Unit Lot Subdivision (ULS)
07/17/2025,003821-25PA,Building & Land Use Pre-Application,Completed,3615   NE  123RD  ST   SEATTLE,,Construct 3 unit townhouse. Future Unit Lot Subdivision.,,,,47.7178383,-122.323448,Unit Lot Subdivision (ULS)
07/17/2025,003827-25PA,Building & Land Use Pre-Application,Additional Info Requested,9412    15TH  AVE  NE  SEATTLE,,"REMOVE EXISTING STRUCTURES. BUILD 8 NEW SINGLE FAMILY RESIDENCES, PER PLAN. PARCEL ""B"" OF LBA PRE-APP 003795-25PA. FUTURE ULS.",,,,47.6970711,-122.3114692,Unit Lot Subdivision (ULS)
07/17/2025,003822-25PA,Building & Land Use Pre-Application,Completed,11705    SAND POINT  WAY  NE  SEATTLE,Herron Sand Point North,"This is to build 1 new house and 2 new DADUs with attached garages.The project is going through an LBA 3042208-LU and demo permit 7013329-DM. There has been a site visit already, project number 7013328-CN which was canceled. There will be 2 separate project numbers and lots using the LBA. The other lot has the address 11703 Sand Point WAY NE.",,,,47.6821366,-122.2636878,Unit Lot Subdivision (ULS)
07/17/2025,003835-25PA,Building & Land Use Pre-Application,Reviews Completed,137   NW  136TH  ST   SEATTLE,,"REMOVE EXISTING STRUCTURES. BUILD 4 NEW SINGLE FAMILY RESIDENCES WITH GARAGE PARKING, PER PLAN. NEW AND REPLACED HARD SURFACES TO BE UNDER 5,000 SF. FUTURE ULS.",,,,47.7280487,-122.359796740135,Unit Lot Subdivision (ULS)
07/17/2025,003832-25PA,Building & Land Use Pre-Application,Completed,9256    PHINNEY  AVE  N  SEATTLE,,Construct a duplex and a single family residence with attached garage. Existing SFR to remain. Demo detached  garage. Provide 2 surface parking.,,,,47.6976754,-122.35372905007583,Duplex + SFR
07/17/2025,003809-25PA,Building & Land Use Pre-Application,Completed,6712    14TH  AVE  NW  SEATTLE,,"DEMOLISH EXISTING BUILDING, CONSTRUCT TWO NEW DUPLEXS, WITH PARKING PER PLAN.",,,,47.6782334,-122.3737605,Multiplex/Cluster
07/17/2025,003829-25PA,Building & Land Use Pre-Application,Additional Info Requested,9412    15TH  AVE  NE  SEATTLE,,"REMOVE EXISTING STRUCTURES. BUILD 2 NEW SINGLE FAMILY RESIDENCES AND 2 NEW TOWNHOME UNITS, PER PLAN. PARCEL ""D"" OF LBA PRE-APP 003795-25PA. FUTURE ULS.",,,,47.6970711,-122.3114692,Unit Lot Subdivision (ULS)
07/17/2025,003838-25PA,Building & Land Use Pre-Application,Completed,5037    36TH  AVE  NE  SEATTLE,,CONSTUCT (3)SFR W/ ATTACHED GARAGES PER PLAN. EXISTING SFRTO BE DEMOLISHED.,,,,47.665995699999996,-122.28936063527397,Multiplex/Cluster
07/17/2025,003823-25PA,Building & Land Use Pre-Application,Completed,11703    SAND POINT  WAY  NE  SEATTLE,Herron Sand Point South,"This is to build 1 new house and 2 new DADUs with attached garages.The project is going through an LBA 3042208-LU and demo permit 7013329-DM. There has been a site visit already, project number 7013328-CN which was canceled. There will be 2 separate project numbers and lots using the LBA. The other lot has the address 11705 Sand Point WAY NE.",,,,47.6821366,-122.2636878,Unit Lot Subdivision (ULS)
07/17/2025,003825-25PA,Building & Land Use Pre-Application,Additional Info Requested,9412    15TH  AVE  NE  SEATTLE,,"REMOVE EXISTING STRUCTURES. BUILD 6 NEW SINGLE FAMILY RESIDENCES AND 2 NEW TOWNHOMES, PER PLAN. PARCEL ""A"" OF LBA PRE-APP 003795-25PA. FUTURE ULS.",,,,47.6970711,-122.3114692,Unit Lot Subdivision (ULS)
07/17/2025,003839-25PA,Building & Land Use Pre-Application,Completed,5918    28TH  AVE  S  SEATTLE,jwa782,CONSTRUCT (1) SFR WITH (1) OPEN PARKING STALL AND (2) TOWNHOUSES WITH (2) ATTACHED GARAGES.,,,,47.6722275,-122.3732711,Single Family Residence
07/17/2025,003818-25PA,Building & Land Use Pre-Application,Completed,7500    45TH  AVE  SW  SEATTLE,,"DEMOLISH EXISTING BUILDING,CONSTRUCT TWO NEW SFR'S, TWO NEW DADU'S, WITH PARKING",,,,47.53571285,-122.3898418505304,DADU
07/17/2025,003828-25PA,Building & Land Use Pre-Application,Additional Info Requested,9412    15TH  AVE  NE  SEATTLE,,"REMOVE EXISTING STRUCTURES. BUILD 8 NEW SINGLE FAMILY RESIDENCES, PER PLAN. PARCEL ""C"" OF LBA PRE-APP 003795-25PA. FUTURE ULS.",,,,47.6970711,-122.3114692,Unit Lot Subdivision (ULS)
07/17/2025,003833-25PA,Building & Land Use Pre-Application,Additional Info Requested,9412    15TH  AVE  NE  SEATTLE,,"REMOVE EXISTING STRUCTURES. BUILD 8 NEW SINGLE FAMILY RESIDENCES, PER PLAN. PARCEL ""F"" OF LBA PRE-APP 003795-25PA. FUTURE ULS.",,,,47.6970711,-122.3114692,Unit Lot Subdivision (ULS)
07/17/2025,003817-25PA,Building & Land Use Pre-Application,Completed,13526    27TH  AVE  NE,WABO checklist,"I would like to use the main level of my home as an adult family home. To accommodate the a sank in family room, which would be turning to bedroom # 4, I would like to add a closet and a small indoor ramp to gain safe access.",,,,47.72737015,-122.29888073864966,Single Family Residence
07/17/2025,003811-25PA,Building & Land Use Pre-Application,Completed,5611    BEACON  AVE  S  SEATTLE,,Demolish Garage and construct DADU,,,,47.55149350000001,-122.30251646831755,DADU
07/17/2025,003841-25PA,Building & Land Use Pre-Application,Completed,2024   S  INGERSOLL  PL   SEATTLE,,CONSTUCT (4)SFR W/ ATTACHED GARAGES PER PLAN. EXISTING SFRTO BE DEMOLISHED.,,,,47.59396405,-122.30505852343553,Multiplex/Cluster
07/16/2025,003776-25PA,Building & Land Use Pre-Application,Completed,8511    18TH  AVE  NW  SEATTLE,DADU - 2 unit,"Split lot into two. Demo existing detached garage, construct 2 new attached DADU in rear yard.",,,,47.69107165,-122.38026460488308,Unit Lot Subdivision (ULS)
07/16/2025,003780-25PA,Building & Land Use Pre-Application,Completed,2618    29TH  AVE  W  SEATTLE,2618 29th Ave W,Remove 1 SFR and build 1 SFR with ADU,,,,47.6438073,-122.39387896109022,ADU
07/16/2025,003779-25PA,Building & Land Use Pre-Application,Completed,13321    3RD  AVE  NE  SEATTLE,,CONSTUCT (4)SFR W/ ATTACHED GARAGES PER PLAN. EXISTING SFRTO BE DEMOLISHED.,,,,47.7256354,-122.32669371197068,Multiplex/Cluster
07/16/2025,003800-25PA,Building & Land Use Pre-Application,Completed,819   S  ROSE  ST   SEATTLE,,Construct 2 new Single Family Residences and 1 DADU. Existing SFR to be demolished.,,,,47.5288511,-122.32199512431848,DADU
07/16/2025,003801-25PA,Building & Land Use Pre-Application,Completed,821   S  ROSE  ST   SEATTLE,,Construct 2 new Single Family Residences and 1 DADU,,,,47.66521285,-122.3179374013337,DADU
07/16/2025,003777-25PA,Building & Land Use Pre-Application,Completed,7315    JONES  AVE  NW  SEATTLE,,"DEMOLISH EXISTING BUILDING,CONSTRUCT FOUR NEW SFR'S, WITH PARKING PER PLAN.",,,,47.68184935,-122.38671459917279,Multiplex/Cluster
07/16/2025,003787-25PA,Building & Land Use Pre-Application,Completed,11247    DAYTON  AVE  N  SEATTLE,Bokova DADU,"Allow new detached accessory dwelling unit, accessory to existing single family use per land use code. Construct new one family dwelling, per standard plan 6794017-SP. Work includes demolition of detached garage.",,,,47.71191,-122.35315384314802,DADU
07/16/2025,003786-25PA,Building & Land Use Pre-Application,Completed,3121   NE  133RD  ST   SEATTLE,Olympic Hills Tiny House Village,Establish a religious controlled emergency transitional housing facility per the land use code. All structures on site are temporary prefabricated units.,,,,47.7244869,-122.2936168,Single Family Residence
07/15/2025,003742-25PA,Building & Land Use Pre-Application,Completed,8729    palatine  AVE  N,,Demolish existing SFR an construct 4 new SFR. Future Unit Lot Subdivision.,,,,47.69327605,-122.35693734645582,Unit Lot Subdivision (ULS)
07/15/2025,003740-25PA,Building & Land Use Pre-Application,Completed,539    26TH  AVE  S  SEATTLE,,"CONSTRUCT A 3 STORY DUPLEX WITH A BASEMENT AND A 3 STORY SINGLE FAMILY STRUCTURE. PARKING TO BE PROVIDED FOR THE DUPLEX IN PRIVATE GARAGES ACCESSED FROM A SHARED CURB CUT ON 26TH AVENUE S, NO PARKING FOR THE SINGLE FAMILY STRUCTURE.",,,,47.59694065,-122.29900511698278,Multiplex/Multifamily
07/15/2025,003767-25PA,Building & Land Use Pre-Application,Completed,1715   N  105TH  ST   SEATTLE,jwa779,"EXISTING SFR TO REMAIN, CONSTRUCT (3) SFRS WITH (3) ATTACHED GARAGES.",,,,47.7047024,-122.33686085494952,Multiplex/Cluster
07/15/2025,003765-25PA,Building & Land Use Pre-Application,Completed,34   W  DRAVUS  ST   SEATTLE,,CONSTRUCT SIX (6) NEW TOWNHOUSES WITH PARKING.  LOT BOUNDARY ADJUSTMENT TO BE COMPLETED UNDER SEPARATE PERMIT. EXISTING STRUCTURES TO BE REMOVED UNDER SEPARATE PERMIT.,,,,47.64881015,-122.35908524999999,Unit Lot Subdivision (ULS)
07/15/2025,003762-25PA,Building & Land Use Pre-Application,Completed,2207   NW  61ST  ST   SEATTLE,,"DEMOLISH EXISTING BUILDING,CONSTRUCT TWO NEW DUPLEXS, WITH PARKING PER PLAN",,,,47.6728811,-122.3851788,Multiplex/Cluster
07/15/2025,003761-25PA,Building & Land Use Pre-Application,Completed,3212    35TH  AVE  S  SEATTLE,,Establish the basement of the existing residence as AADU.,,,,47.5747873,-122.28854505408702,AADU
07/15/2025,003763-25PA,Building & Land Use Pre-Application,Completed,42   W  DRAVUS  ST   SEATTLE,,CONSTRUCT SEVEN (7) NEW TOWNHOUSES WITH PARKING.  LOT BOUNDARY ADJUSTMENT TO BE COMPLETED UNDER SEPARATE PERMIT. EXISTING STRUCTURES TO BE REMOVED UNDER SEPARATE PERMIT.,,,,47.648894999999996,-122.35945184234676,Unit Lot Subdivision (ULS)
07/15/2025,003764-25PA,Building & Land Use Pre-Application,Completed,36   W  DRAVUS  ST   SEATTLE,,CONSTRUCT SIX (6) NEW TOWNHOUSES WITH PARKING.  LOT BOUNDARY ADJUSTMENT TO BE COMPLETED UNDER SEPARATE PERMIT. EXISTING STRUCTURES TO BE REMOVED UNDER SEPARATE PERMIT.,,,,47.64886965,-122.35926560706821,Unit Lot Subdivision (ULS)
07/15/2025,003766-25PA,Building & Land Use Pre-Application,Completed,4307    12TH  AVE  S  SEATTLE,,ADDING THREE MORE RESIDENTIAL UNITS TO EXISTING LOT,,,,47.565054450000005,-122.31758330067456,Multiplex/Cluster
07/14/2025,003722-25PA,Building & Land Use Pre-Application,Completed,1212   N  ALLEN  PL   SEATTLE,,5-LOT ULS,,,,47.66086485,-122.34305855,Unit Lot Subdivision (ULS)
07/14/2025,003737-25PA,Building & Land Use Pre-Application,Completed,6048    35TH  AVE  NE  SEATTLE,6048 AADU,Converting existing finished daylight basement to AADU,,,,47.673621499999996,-122.28995705815379,AADU
07/14/2025,003708-25PA,Building & Land Use Pre-Application,Completed,11519    5TH  AVE  NE  SEATTLE,,"Construct new SFR. Existing SFR, AADU and DADU to remain.",,,,47.7060807,-122.3230968,DADU
07/14/2025,003713-25PA,Building & Land Use Pre-Application,Completed,4720    7TH  AVE  NE  SEATTLE,New SFR 4720 7th Ave,New 178 sq ft SFR to be added to 4720 7th Ave NE,,,,47.66382085,-122.32043751801798,Multiplex/Cluster
07/14/2025,003739-25PA,Building & Land Use Pre-Application,Completed,5914    8TH  AVE  NW  SEATTLE,New Parcel,"This project proposes to subdivide an existing residential parcel in the City of Seattle into two separate lots, in accordance with the recently adopted Interim Land Use Legislation aimed at expanding housing options. The subdivision will comply with updated zoning provisions that allow for increased flexibility in lot size, access, and development standards. The proposed split will create two legal parcels suitable for residential development, supporting the city's goals of promoting infill housing and addressing the regional housing shortage.",,,,47.67205665,-122.36587632296946,Unit Lot Subdivision (ULS)
07/14/2025,003738-25PA,Building & Land Use Pre-Application,Completed,530   NE  88TH  ST   SEATTLE,Hsiao and Razzak New Home,Demolish existing one story home with basement and build new 2- story home with attached garage.,,,,47.6924024,-122.32167305199998,Single Family Residence
07/12/2025,003700-25PA,Building & Land Use Pre-Application,Completed,6412    28TH  AVE  S  SEATTLE,28TH AVENUE RESIDENCES,"DEMOLISH EXISTING SINGLE FAMILY RESIDENCE, CARPORT, AND DETACHED GARAGE, CONSTRUCT FOUR NEW SINGLE FAMILY DWELLING UNITS WITH SURFACE PARKING.",,,,47.54487335,-122.29660117156249,Multiplex/Cluster
07/11/2025,003694-25PA,Building & Land Use Pre-Application,In Process,1949    6TH  AVE  W  SEATTLE,Queen Anne Townhomes,Demolition of Existing Single Family Residence and Detached Garage. New Construction of (2) Dwelling Units and (1) DADU.,,,,47.6373872,-122.36533899833755,Townhouse
07/11/2025,003688-25PA,Building & Land Use Pre-Application,Completed,4509    EASTERN  AVE  N,4509 Eastern Ave. TH,Demolition of existing dwelling and construction of (4) townhomes,,,,47.66182485,-122.32933005454063,Townhouse
07/11/2025,003678-25PA,Building & Land Use Pre-Application,Completed,7040    53RD  AVE  NE  SEATTLE,Approach Build 7040 53rd,New Singel family house with ADU and attached garage,,,,47.68055215,-122.27030968680876,ADU
07/11/2025,003698-25PA,Building & Land Use Pre-Application,Completed,2809   W  GARFIELD  ST   SEATTLE,,"Demolish existing single family home, construct SFR and DADU per plan",,,,47.6335709,-122.39363235583446,DADU
07/11/2025,003696-25PA,Building & Land Use Pre-Application,Completed,3201   S  WEBSTER  ST   SEATTLE,jwa778,Existing SFR to remain and construct (2) units with (2) attached garages.,,,,47.5350709,-122.29121777964548,Multiplex/Cluster
07/11/2025,003697-25PA,Building & Land Use Pre-Application,Completed,2718   NE  94TH  ST   SEATTLE,KENMORE SFRS,CONSTRUCT THREE NEW SFRS AND MAINTAIN EXISTING SFR.,,,,47.69677835,-122.29790119620826,Multiplex/Cluster
07/11/2025,003692-25PA,Building & Land Use Pre-Application,Completed,212   N  100TH  ST   SEATTLE,Rupp Conversion,***FULL PLAN REVIEW REQUIRED**Convert garage below DADU into living space.,,,,47.70167345,-122.360056221134,DADU
07/10/2025,003667-25PA,Building & Land Use Pre-Application,Completed,6522    42nd  AVE  NE,Winfield 6522 42nd,This is a demo of an existing house and construction of a new house with an attached garage.,,,,47.6765244,-122.28327747060932,Single Family Residence
07/10/2025,003643-25PA,Building & Land Use Pre-Application,Completed,7603    8TH  AVE  NW  SEATTLE,,"DEMOLISH EXISTING BUILDING,CONSTRUCT TWO NEW DUPLEXS, WITH PARKING PER PLAN.",,,,47.68416445,-122.36648004163749,Multiplex/Cluster
07/10/2025,003657-25PA,Building & Land Use Pre-Application,Completed,3101   NE  CLARK  RD   SEATTLE,,"PARKING LOT E04 WILL INSTALL AND PROVIDE FOUR ADA ACCESSIBLEPARKING SPACES WITH ACCESS AISLES. INSTALLATION OF NEW ADACOMPLIANT RAMPS AND PATHWAYS, DRIVEWAY AND NEW CURB",,,,,,Multiplex/Cluster
07/10/2025,003666-25PA,Building & Land Use Pre-Application,Completed,4228    LATONA  AVE  NE  SEATTLE,,"DEMOLISH EXISTING BUILDING,CONSTRUCT TWO NEW DUPLEXS, WITH PARKING PER PLAN.",,,,47.6585478,-122.32483690000001,Multiplex/Cluster
07/10/2025,003646-25PA,Building & Land Use Pre-Application,Completed,6044    4th  AVE  NE,Andreini DADU,New construction DADU accessory building to an existing single family residence.,,,,47.6067142,-122.33269832546111,DADU
07/09/2025,003635-25PA,Building & Land Use Pre-Application,Additional Info Requested,1925   NE  NORTHGATE  WAY,1925 Demo,Proposed to remove an existing SFR on site,,,,47.7095862,-122.3233343,Single Family Residence
07/09/2025,003622-25PA,Building & Land Use Pre-Application,Completed,422    11TH  AVE  E  SEATTLE,,CONVERT AN EXISTING 8-UNIT APARTMENT BUILDING WITH 54 TOTAL BEDROOMS INTO A 64-UNIT CONGREGATE RESIDENCE.,,,,47.62263355,-122.3175018,Multiplex/Multifamily
07/09/2025,003625-25PA,Building & Land Use Pre-Application,Completed,2371    FRANKLIN  AVE  E  SEATTLE,,CONVERT AN EXISTING 5-UNIT APARTMENT BUILDING WITH 40 TOTAL BEDROOMS INTO A 44-UNIT CONGREGATE RESIDENCE.,,,,47.64179025,-122.32495117502867,Multiplex/Multifamily
07/09/2025,003634-25PA,Building & Land Use Pre-Application,Completed,116    13TH  AVE  E,,Establish (3) existing sleeping rooms in existing congregate residence.,,,,47.6022321,-122.3147416,Multiplex/Cluster
07/09/2025,003633-25PA,Building & Land Use Pre-Application,Withdrawn,3254   NW  MARKET  ST   SEATTLE,,"CONSTRUCT (4) NEW UNIT PER PLAN, 4 PARKING PROVIDED, EXISTING SFR TO REMAIN. (LOCATED IN 1/4 MILE FROM MAJOR TRANSIT STOP, 6 UNIT ALLOWED)",,,,47.668798699999996,-122.4007139398451,Multiplex/Cluster
07/09/2025,003627-25PA,Building & Land Use Pre-Application,Completed,3536    43RD  AVE  W  SEATTLE,CC 43RD AVE DADU,*Full plan review required* Construct DADU around existing Garage,,,,47.652423,-122.4129943449638,DADU
07/08/2025,003620-25PA,Building & Land Use Pre-Application,Completed,10002    9TH  AVE  NW  SEATTLE,KYLE SFR,CONSTRUCT ONE NEW SFR ON A LOT WITH AN EXISTING SFR. PASV DONE UNDER 000425-25PA,,,,47.70169265,-122.36844314648332,Multiplex/Cluster
07/08/2025,003600-25PA,Building & Land Use Pre-Application,Completed,7708    44TH  AVE  NE  SEATTLE,,"DEMO EXISTING STRUCTURE. CONSTRUCT A NEW SFR, AND DUPLEX WITH PARKING PER PLAN.",,,,47.68523275,-122.28074652449365,Duplex + SFR
07/08/2025,003602-25PA,Building & Land Use Pre-Application,Completed,4022    32ND  AVE  W  SEATTLE,,"DEMOLISH EXISTING BUILDING,CONSTRUCT FOUR NEW SFR'S, WITH PARKING PER PLAN.",,,,47.5671667,-122.37221392375,Multiplex/Cluster
07/08/2025,003601-25PA,Building & Land Use Pre-Application,Completed,1919    2ND  AVE  W  SEATTLE,,"DEMOLISH EXISTING SFR. CONSTRUCT NEW TWO NEW DUPLEX'S, WITH PARKING PER PLAN.",,,,47.6366291,-122.3601148,Duplex + SFR
07/08/2025,003604-25PA,Building & Land Use Pre-Application,Completed,8718    LINDEN  AVE  N,,6-LOT ULS,,,,47.69251715,-122.34697322932303,Unit Lot Subdivision (ULS)
07/08/2025,003603-25PA,Building & Land Use Pre-Application,Completed,8307    27TH  AVE  NW  SEATTLE,,"DEMOLISH EXISTING BUILDING,CONSTRUCT FOUR NEW SFR'S, WITH PARKING PER PLAN.",,,,47.689286800000005,-122.39112850661542,Multiplex/Cluster
07/07/2025,003588-25PA,Building & Land Use Pre-Application,Completed,604   N  143rd  ST,,2-lot short plat,,,,47.7325727,-122.35134991194076,Unit Lot Subdivision (ULS)
07/07/2025,003594-25PA,Building & Land Use Pre-Application,Completed,2450    4TH  AVE  W,ADAM SFR,CONSTRUCT ONE NEW SFR ON LOT WITH EXISTING SFR,,,,47.641073250000005,-122.36191633068069,Single Family Residence
07/04/2025,003577-25PA,Building & Land Use Pre-Application,Completed,3712   SW  HOLDEN  ST   SEATTLE,,*full plan review required* Remove existing Garage and construct new garage with DADU on top.,,,,47.5336991,-122.37991144916845,DADU
07/03/2025,003562-25PA,Building & Land Use Pre-Application,Completed,7748    25TH  AVE  NW  SEATTLE,,"DEMOLISH EXISTING BUILDING, CONSTRUCT TWO NEW DUPLEXS, WITH PARKING PER PLAN.",,,,47.6863793,-122.38847598526011,Multiplex/Cluster
07/03/2025,003561-25PA,Building & Land Use Pre-Application,Completed,1208   NW  77TH  ST   SEATTLE,1208 NW 77th St,"Demo 1 SFR, rebuild 1 SFR AADU",,,,47.68530775,-122.37185249999999,AADU
07/03/2025,003554-25PA,Building & Land Use Pre-Application,Completed,2013   NW  64TH  ST   SEATTLE,OA BAL2013,"Demolish existing single family residence and associated site improvements.Construct two, 3-story duplexes and associated site improvements per plan.",,,,47.675104,-122.38292150000001,Single Family Residence
07/03/2025,003551-25PA,Building & Land Use Pre-Application,Completed,2911   S  MASSACHUSETTS  ST   SEATTLE,Mount Baker Basement AADU,*Full plan review required* Converting existing basement into an AADU,,,,47.58779165,-122.29431705505513,AADU
07/02/2025,003528-25PA,Building & Land Use Pre-Application,Completed,8844    INTERLAKE  AVE  N  SEATTLE,Wu New Unit 4,Construct attached new multifamily unit to existing structure.,,,,47.69366465,-122.33991861100925,Multiplex/Multifamily
07/02/2025,003527-25PA,Building & Land Use Pre-Application,Completed,2437   S  JUDKINS  ST   SEATTLE,Adams DADUs,Two attached DADUs in rear of lot,,,,47.591883949999996,-122.29962922664583,DADU
07/02/2025,003533-25PA,Building & Land Use Pre-Application,Completed,10222    55TH  AVE  S  SEATTLE,HAI BACH DADU,CONSTRUCTION OF PRE-APPROVED DADU IN REAR YARD PER STANDARD PLAN 6794017-SP. NPRHS UNDER 750 SF.,,,,47.508899,-122.26420540783869,DADU
07/02/2025,003544-25PA,Building & Land Use Pre-Application,Completed,9528    28TH  AVE  NW  SEATTLE,CGP 106 - Construction Permit,Construction of new SFR or Duplex.  Demolish existing SFR.,,,,47.69880605,-122.39295905905851,Duplex + SFR
07/02/2025,003530-25PA,Building & Land Use Pre-Application,Completed,1201    3RD  AVE   SEATTLE,,"Â±863 SF, DEMOLITION OF EXISTING CONVENIENCE STAIRS; NEW STRUCTURAL FLOOR INFILL OF FLOOR OPENINGS (46TH, 47TH, 48TH, AND 49TH FLOORS). NO CHANGE IN EXITING, NO CHANGE IN EGRESS, NO CHANGE IN PLUMBING FIXTURES. NEW NON-STRUCTURAL TEMPORARY PARTITION ON THE 45TH FLOORTO CLOSE OFF ACCESS TO 46TH FLOOR.",,,,47.60717065,-122.33609962712065,Single Family Residence
07/01/2025,003510-25PA,Building & Land Use Pre-Application,Completed,3841    37TH  AVE  SW  SEATTLE,,"Demolish existing detached garage, and construct a new duplex with (1) AADU, parking per plan.The existing single-family residence to remain.",,,,47.5686713,-122.37908987466588,AADU
07/01/2025,003499-25PA,Building & Land Use Pre-Application,Completed,11039    35TH  AVE  NE  SEATTLE,W THING 11039 35TH AVE NE,"DEMOLISH ALL STRUCTURES ON SITE.  CONSTRUCT FOUR OR SIX DETACHED DWELLINGS, DEPENDING ON PENDING TRANSIT MAP ALLOWANCE.  PROVIDE SIX SURFACE PARKING STALLS.",,,,47.70950795,-122.29102755305152,Multiplex/Cluster
07/01/2025,003506-25PA,Building & Land Use Pre-Application,Completed,130   NE  133RD  ST,Jain New Duplex,CONSTRUCTION OF A NEW 3-STORY DUPLEX UNIT.,,,,47.6077008,-122.3385575,Multiplex/Multifamily
07/01/2025,003508-25PA,Building & Land Use Pre-Application,Withdrawn,3002    ALKI  AVE  SW  SEATTLE,,"DEMO EXISTING SFR, CONSTRUCT(4) ROWHOUSES WITH (2) GARAGES AND (4) OPEN PARKINGSTALLS. FUTURE UNIT LOT SUBDIVISION.",,,,47.57734015,-122.41606860710246,Unit Lot Subdivision (ULS)
07/01/2025,003516-25PA,Building & Land Use Pre-Application,Completed,6216    CHATHAM  DR  S  SEATTLE,Ahdut Development,"Develop duplex on Back half of 6216 Chatham Dr S, accessed of Wilson Ave.",,,,47.546788750000005,-122.26416004735111,Multiplex/Multifamily
07/01/2025,003498-25PA,Building & Land Use Pre-Application,Completed,730   N  98TH  ST   SEATTLE,730 N 98TH ST,DEMOLISH EXISTING HOUSE.  CONSTRUCT SIX NEW TOWNHOUSE DWELLINGS WITH UP TO SIX PARKING STALLS.,,,,47.700719750000005,-122.34870110631451,Townhouse
07/01/2025,003495-25PA,Building & Land Use Pre-Application,Completed,3309    25TH  AVE  S  SEATTLE,3309 25TH Ave,"Demolish Existing ResidenceConstruct (2), Detached Two-Family Dwelling Units.",,,,47.573762599999995,-122.30093872564433,Multiplex/Cluster
07/01/2025,003503-25PA,Building & Land Use Pre-Application,Completed,11704    16TH  AVE  NE  SEATTLE,,DEMOLISH EXISTING SINGLE-FAMILY RESIDENCE AND CONSTRUCT (4) SINGLE-FAMILY UNITS WITH (4) GARAGES,,,,47.7141379,-122.31086704571044,Multiplex/Cluster
06/30/2025,003474-25PA,Building & Land Use Pre-Application,Completed,1105    33RD  AVE  S  SEATTLE,,CONSTRUCT (2) SFR'S AND (2) ADU'S WITH (3) GARAGE PARKING STALLS,,,,47.593237349999995,-122.29060336692626,ADU
06/30/2025,003480-25PA,Building & Land Use Pre-Application,Completed,218    31ST  AVE  E  SEATTLE,216 31st Ave E SFR x4,"Demolish existing duplex, construct four (4) new SFRs with garage parking.",,,,47.6038043,-122.2924058,Duplex + SFR
06/30/2025,003461-25PA,Building & Land Use Pre-Application,Completed,6230    7TH  AVE  NW  SEATTLE,ERIC YU DUPLEX,ESTABLISH USE OF EXISTING SFR AS A DADU. CONSTRUCT TWO NEW SFRS AND OCCUPY PER PLAN,,,,47.675144849999995,-122.36479063750355,Duplex + SFR
06/30/2025,003491-25PA,Building & Land Use Pre-Application,Completed,9009    51ST  AVE  NE,Longoni Residence (New Code PASV Request),"Please provide a new PASV associated with scope under new codes: Vacant lot, construct four new primary residences with on site parking.",,,,47.52323645,-122.28624729495132,Multiplex/Cluster
06/30/2025,003471-25PA,Building & Land Use Pre-Application,Completed,2100   N  128TH  ST   SEATTLE,MEKIAS SFR,CONSTRUCT ONE NEW SFR AND ONE NEW DADU. EXISTING SFR TO REMAIN.,,,,47.722285299999996,-122.33390127816048,DADU
